{
  "budget": {
    "max_edges": 0,
    "max_items": 4
  },
  "canonical_admission": "NOT_EVALUATED",
  "chart_axis_rescaled": false,
  "chart_window": "not_applicable",
  "completeness": "COMPLETE_INPUT_VIEW",
  "content_status": "declared_unverified",
  "counts": {
    "edges_omitted": 0,
    "edges_shown": 0,
    "facet_bindings_omitted": 0,
    "items_omitted": 0,
    "items_shown": 4,
    "source_edges": 0,
    "source_items": 4
  },
  "current_authority": "NOT_EVALUATED",
  "displayed_facet_bindings": [
    {
      "basis": "declared_unverified",
      "declaration_ref": "fixture:VP03/chart_inventory/semantics/metric/fixture.resource_count",
      "lens": "cube.lens.semantics",
      "note": "Compare the declared metric definition",
      "target_id": "fixture.resource_count",
      "target_kind": "metric"
    },
    {
      "basis": "declared_unverified",
      "declaration_ref": "fixture:VP03/chart_inventory/semantics/sample/artifact",
      "lens": "cube.lens.semantics",
      "note": "Declared category identity",
      "target_id": "artifact",
      "target_kind": "sample"
    },
    {
      "basis": "declared_unverified",
      "declaration_ref": "fixture:VP03/chart_inventory/provenance/metric/fixture.resource_count",
      "lens": "cube.lens.provenance",
      "note": "Inspect source and declared unit",
      "target_id": "fixture.resource_count",
      "target_kind": "metric"
    },
    {
      "basis": "declared_unverified",
      "declaration_ref": "fixture:VP03/chart_inventory/provenance/sample/source",
      "lens": "cube.lens.provenance",
      "note": "Declared source category",
      "target_id": "source",
      "target_kind": "sample"
    },
    {
      "basis": "declared_unverified",
      "declaration_ref": "fixture:VP03/chart_inventory/execution/sample/revisions",
      "lens": "cube.lens.execution",
      "note": "Illustrative operational-planning emphasis",
      "target_id": "revisions",
      "target_kind": "sample"
    },
    {
      "basis": "declared_unverified",
      "declaration_ref": "fixture:VP03/chart_inventory/governance/sample/evidence",
      "lens": "cube.lens.governance",
      "note": "Illustrative audit focus, no policy evaluation",
      "target_id": "evidence",
      "target_kind": "sample"
    },
    {
      "basis": "declared_unverified",
      "declaration_ref": "fixture:VP03/chart_inventory/epistemology/sample/artifact",
      "lens": "cube.lens.epistemology",
      "note": "Illustrative data quality focus",
      "target_id": "artifact",
      "target_kind": "sample"
    },
    {
      "basis": "declared_unverified",
      "declaration_ref": "fixture:VP03/chart_inventory/epistemology/sample/evidence",
      "lens": "cube.lens.epistemology",
      "note": "Declared evidence category, not confirmed proof",
      "target_id": "evidence",
      "target_kind": "sample"
    }
  ],
  "epistemic_warrant": "NOT_EVALUATED",
  "focus": null,
  "format": "aiaeao.cube.vp04-print-report/1",
  "granularity": "standard",
  "lens": "cube.lens.governance",
  "lens_emphasis": "declared_unverified",
  "notices": [
    "Aggregated count is display-only: no virtual entity, predicate or measurement was synthesized.",
    "Every omitted element and edge is retained by identifier in this report and SVG metadata.",
    "Chart subset scaling must not be compared across levels unless chart_axis_rescaled=false.",
    "Layouts, lens markers, focus and filtering never imply verified truth or granted authority."
  ],
  "omitted_edges": [],
  "omitted_facet_bindings": [],
  "omitted_item_ids": [],
  "overflow": "summarize",
  "profile": "P2-VP-GRANULARITY/0.4.0",
  "reduced_view_sha256": "309d8e41e37af240fd16ef3fd95b10d76cee2da3a58681430585e44c3b71c2c1",
  "reference_version": "v9.4",
  "render_status": "PASS",
  "semantic_conformance": "NOT_EVALUATED",
  "shown_edges": [],
  "shown_item_ids": [
    "artifact",
    "source",
    "evidence",
    "revisions"
  ],
  "source_bundle_sha256": "545e2d0f60db41409efdddf2c35f84bbd949d64ae464b9dc7b3cc1617a9725f7",
  "source_view_sha256": "309d8e41e37af240fd16ef3fd95b10d76cee2da3a58681430585e44c3b71c2c1",
  "svg_sha256": "7967d984ed6e1421a169826acfe7aecf06e6704df85e27b91744585f47775c36",
  "view": "cube.diagramm"
}
